qi,query,rank_a,rank_b,rank_f
826,Multicolor embroidered net saree with blouse,29,7,8
827,Arrow Solid Single Breasted Casual Men's Blazer,17,10,2
828,Arrow New YorkMen Black Regular Fit Solid Formal Shirt,37,26,30
829,Mocking Bird Printed Women Blue Regular Shorts,101,101,101
830,Fort CollinsWomen Navy Solid Hooded Sweatshirt,10,2,5
831, Blue Georgette Georgette Semi Stitched Flared Ethnic Suits Semi stitched ,15,5,11
832,BlackberrysMen Purple Slim Fit Self Design Formal Shirt,78,21,31
833,FabAlley Casual 3/4th Sleeve Solid Women Yellow Top,6,1,3
834,Marie ClaireWomen Blue Solid Single-Breasted Blazer,19,12,17
835,HERE&NOWWomen Olive Green Solid Puffer Jacket,5,1,3
836,FOREVER 21Women Cream-Coloured Solid Sweatshirt,9,18,11
837,Peter England EliteMen Purple & Pink Slim Fit Printed Casual Shirt,101,101,101
838,Black Darrys Regular Fit Men's Black Trousers,101,70,101
839,Burdy Sleeveless Solid Men's Jacket,101,101,101
840,"Veni Vidi Vici Casual Half Sleeve Solid, Stylised, Self Design Women's Black Top",36,96,44
841,VERONIQUE Solid Women's Pink Hotpants,83,30,53
842,Nick&JessMen Pack of 2 Printed Boxers MNSBXR006B6C,8,17,16
843,Hawai WB00302 Lycra Self Design Burqa With Hijab,101,101,101
844,Metronaut Men Printed Casual Multicolor Shirt,1,1,1
845,Mosho Casual 3/4th Sleeve Printed Women's Multicolor Top,101,101,101
846,Parvin 3122XL Georgette Solid Burqa,56,101,101
847,ZealMen Olive Green & Brown Solid Formal Shirt,27,3,12
848,Wrangler Men's Printed Casual Blue Shirt,101,101,101
849,"Belmarsh Solid Women Black, Blue, Black, Red Cycling Shorts",26,30,26
850,RaymondMen White Regular Fit Printed Formal Shirt,101,101,101
851,Indigo Nation Street Regular Fit Men's Black Trousers,101,101,101
852,MartiniWomen Black Striped Sweatshirt,1,2,1
853,Yellow pure georgette emb. semiStitched salwar with dupatta semi stitched,13,14,11
854,Moda RapidoWomen Pink Solid Hooded Sweatshirt,1,3,2
855,Alan Jones Camouflage Men's Green Track Pants,9,5,6
856,Wonder WomanWomen Grey Melange Printed Sweatshirt,101,101,101
857, Green Embroidered Georgette Anarkali Salwar Kameez Wtih Dupatta Semi stitched ,5,2,3
858,Van HeusenMen Maroon Regular Fit Checked Formal Shirt,30,101,45
859,ZACHARIAS Men's Cargos,101,13,15
860,"Dee Mannequin Solid Women's Red, Dark Blue, Black Basic Shorts",75,23,26
861,FashionScrapbook Full Sleeve Solid Men's Jacket,101,46,25
862,Crux & Hunter Printed Men's Multicolor Running Shorts,101,101,101
863, Light Blue Embroidered Art Silk Semi Stitched Lehenga With Dupatta ,23,21,22
864,Fast n Fashion Slim Fit Men's Cream Trousers,66,101,101
865,Embroidered Chanderi Silk Straight Suit in Teal Blue,5,9,4
866,Rare Casual Sleeveless Solid Women's Maroon Top,15,11,13
867,Plain Rayon Asymmetric Anarkali Suit in Blue,2,1,1
868,Levi's Men's Printed Casual Beige Shirt,101,101,101
869,Got It Full Sleeve Solid Men's Denim Jacket,24,6,11
870,Asics Full Sleeve Solid Men's Jacket,1,1,1
871,MadameWomen Red Solid Cardigan,12,16,11
872,High Hill Full Sleeve Solid Men's Sweatshirt,101,101,101
873,Kotty Checkered Women's Blue Night Shorts,7,2,4
874,TYCON Skinny Men's Black Jeans,101,101,101
875,Mast & Harbour Full Sleeve Solid Men's Sweatshirt,2,101,8
876, Beige Pashimina Silk Printed Saree With Blouse ,54,18,29
877,JUMP USA Sleeveless Solid Men Jacket,1,3,1
878,AnoukWomen Beige & Pink Printed Cardigan,2,1,1
879,Embroidered Georgette Anarkali Suit in Multicolor,8,9,7
880,Hangup Men's Solid Casual Blue Shirt,101,101,101
881,Arrow New YorkMen Grey Skinny Fit Self Design Formal Shirt,1,3,1
882,Campus SutraWomen Grey Colourblocked Sweatshirt,6,10,7
883,FREAKINSFreakins Women Pink Solid Dungarees,7,6,6
884,DOROTHY PERKINSWomen Grey Solid Faux Fur Jacket,2,1,1
885,"Belmarsh Solid Women White, Blue, Black, Red Cycling Shorts",79,101,73
886,Modest Forever P138 Heather Moss Abaya With Hijab,101,101,101
887,Park Avenue Tapered Men Dark Blue Trousers,53,71,39
888,Wild Hunk Men's Solid Casual Brown Shirt,7,3,2
889,Ed Hardy Printed Men's Black Track Pants,1,5,2
890,DressBerryWomen Taupe Printed Hooded Sweatshirt,3,9,2
891,justkartit JK4787 Quality Lycra Solid Abaya With Hijab,101,82,62
892,Cation Casual 3/4th Sleeve Solid Women's Red Top,50,101,79
893,"TSX Printed, Solid Men's Black, Blue Track Pants",38,93,40
894,Bandhej Georgette Long Skirt in Orange,1,1,1
895,Rodid Solid Men's Orange Basic Shorts,1,1,1
896,SpeciesWomen Black Solid Cardigan,2,1,1
897,Flying Machine Solid Men's Brown Basic Shorts,22,38,25
898,John PlayersMen Pink Slim Fit Solid Formal Shirt,39,60,37
899,PumaStyle Collegiate Blue Hoodie,11,57,13
900,Abaya AL1037 Crepe Self Design Burqa With Hijab,101,30,64
901,Forever 21 Casual Short Sleeve Solid Women's Brown Top,13,7,8
902, Multicolor Printed Manipuri Silk Saree With Blouse ,101,29,101
903,HancockMen Blue & White Slim Fit Checked Formal Shirt,50,17,28
904,Van Heusen SUit Solid Men's Suit,82,89,81
905,Van HeusenMen Taupe Slim Fit Self Design Formal Shirt,75,49,58
906,Plain Cotton Lycra Patiala Salwar in Off White,5,3,4
907,Mast & HarbourWomen Grey & Pink Colourblocked Sporty Jacket,1,1,1
908,Peptrends Self Design Women's Red Basic Shorts,101,66,101
909, Hot Pink Embroidered Chiffon Saree With Blouse ,66,56,55
910,Bandhej Georgette Long Skirt in Pink,1,1,1
911,Marie ClaireWomen Grey Melange Solid Sweatshirt,101,101,101
912,RoadsterWomen Olive Green Solid Dungarees,6,7,7
913,Peptrends Solid Women's Blue Hotpants,39,50,37
914,Modest Forever P259 Heather Moss / Poly Moss Abaya,101,101,101
915,Fort CollinsWomen Grey Solid Parka Jacket,5,9,4
916,ADIDAS NEO Printed Men's Blue Track Pants,1,1,1
917,AWG Full Sleeve Striped Men's Sweatshirt,101,101,101
918,Momin Libas AK21617S Polyester Solid Burqa,10,101,12
919,RAREWomen Orange Solid Sweatshirt,2,1,2
920,SASSAFRASWomen Red Printed Sweatshirt,11,6,10
921,Woven Art Silk Jacquard Kurta Set in Cream,38,16,21
922,"KNIT ABC Garments Solid Women's Blue, Green, Orange Sports Shorts, Cycling Shorts",22,101,27
923,RoadsterWomen Green Self Design Cardigan,1,3,1
924,Sports 52 Wear Full Sleeve Striped Men's Sweatshirt,40,4,19
925,Vego Black Piping Solid Men's Black Track Pants,8,2,3
926,"Belmarsh Solid Women Black, Red, Dark Blue Cycling Shorts",49,9,31
927,FirstClapKids Purple Solid Dungaree,5,1,4
928,Modest Forever P151 Poly Moss / Heather Moss Abaya,101,101,101
929,Tokyo Talkies Casual Butterfly Sleeve Floral Print Women's Pink Top,5,6,5
930,2GOWomen Grey Solid Hooded Sweatshirt,5,8,3
931,Momin Libas A 32-14_54 Kashibo Abaya,101,101,101
932,CaymanWomen Grey & Black Self Design Longline Cardigan,2,4,2
933, Beige Designer Embroidered Patch Stone And Beautiful Floral Design Moss Chiffon Saree With Blouse ,1,3,2
934,BIS Creations Self Design Men's Grey Track Pants,19,101,18
935,Park Avenue Slim Fit Men Brown Trousers,14,2,13
936,Lee Skinny Men's Blue Jeans,4,1,2
937,Hartmann Rain Self Design Men's Waistcoat,101,101,101
938,Van HeusenMen Maroon Solid Formal Shirt,2,69,12
939,OVSWomen Black & White Self Design Cardigan,5,101,28
940,Van HeusenMen Orange Regular Fit Self Design Formal Shirt,3,10,8
941,Brown cotton a la mode thobe,2,3,3
942,FLEXIMAA Casual Half Sleeve Solid Women's Maroon Top,26,18,24
943,Embroidered Anarkali Georgette Readymade Suit in Black,1,6,3
944,Light green & multi glaze cotton printed & embroidered women's salwar suit unstitched,1,1,1
945, Bronze And Red Printed Kraft Silk Saree With Blouse ,1,2,1
946,Embroidered Net Lehenga in Fuchsia,3,2,2
947, Navy Blue Embroidered Silk Saree With Blouse ,4,8,4
948,Alsace Lorraine ParisWomen Yellow & Pink Colourblocked Hooded Sweatshirt,1,1,1
949,Next LookMen Pink Slim Fit Self Design Formal Shirt,101,101,101
950,Black faux geogrette embroidery  and  zari  and  lace work semiStitched salwar semi stitched,48,64,51
951,Locomotive Slim Men's Light Blue Jeans,101,101,101
952, Purple Woven Silk Saree With Blouse ,101,41,93
953,Mast & HarbourWomen Black & Red Printed Bomber Jacket,2,1,1
954,Arv Fashion Casual Cap Sleeve Printed Women White Top,31,49,28
955,Harpa Casual 3/4th Sleeve Solid Women's Green Top,1,2,1
956,"Blinkin Distressed Women Blue Denim Shorts, Hotpants",45,101,57
957,"LAWMAN PG3 Men's Printed Casual Black, White Shirt",101,101,101
958,"La Milano Men's Checkered Casual Blue, Green Shirt",35,14,14
959,Prayyan Solid Men's Waistcoat,101,101,101
960,UNDER ARMOURMen Charcoal Grey Original Series Printed Boxerjock Trunks 1307038-019,1,1,1
961,Checkersbay Solid Men's White Basic Shorts,34,30,24
962,BibaWomen Grey Melange & Brown Longline Duster Jacket,15,50,22
963,RABIYA COLLECTION HKMC002 LYCRA Chevron Burqa,101,101,101
964,"Cation Casual 3/4th Sleeve Solid Women's Grey, Blue Top",16,7,7
965,Indian Terrain Men's Checkered Casual Brown Shirt,19,11,16
966,Wrangler Regular Men's Dark Green Jeans,8,35,12
967,John Miller Slim Fit Men's Black Trousers,101,101,101
968,Digital Printed Georgette Saree in Sky Blue and Light Green,12,1,6
969,Urbano Fashion Men's Self Design Casual Denim Black Shirt,50,9,25
970,Provogue Slim Fit Men's Black Trousers,101,101,101
971,Mens dhoti with mejantha boarder,12,6,8
972,Momin Libas AK20317 Polyester Solid Burqa,82,28,15
973,Allen Solly Men's Checkered Casual Red Shirt,19,1,4
974,FabAlley Casual 3/4th Sleeve Solid Women Red Top,101,17,60
975,FOREVER 21White Solid Dungarees,3,5,4
976,Pepe Jeans Solid Women's Round Neck White T-Shirt,88,44,89
977, Peach Zari Art Silk Saree With Blouse ,52,27,34
978,Only Vimal Slim Men's Blue Jeans,45,101,101
979,Juniors by LifestyleGirls Solid Dungarees,82,9,29
980,Red and darkolivegreen cotton jaqcuard party wear straight suit semi stitched,1,4,1
981,"Allen Solly Men's Printed Casual Black, White Shirt",101,14,100
982,Teesort Solid Men's Grey Track Pants,17,101,101
983,"Mark Taylor Men's Checkered Casual Dark Blue, White Shirt",101,101,101
984,Louis Philippe 2 Piece Printed Men's Suit,7,14,4
985,justkartit JK4761 Lycra Burqa With Hijab,101,63,45
986,Blue cotton poly traditional solid kurta pajama,1,1,1
987,Spykar Solid Men's Blue Chino Shorts,17,5,11
988,VERO LIE Men's Solid Casual White Shirt,17,101,101
989,RoadsterWomen Maroon Solid Hooded Parka Jacket,1,1,1
990,Green woven kurta set with contrast corded  maroon placket patti with  corded collar,8,9,7
991, Mimosa Maroon Art Silk Kanchipuram Style Saree With Blouse ,4,1,2
992,OxolloxoWomen White Solid Hooded Sweatshirt,3,1,1
993,ONLYWomen White Printed Sweatshirt,9,1,3
994,RoadsterWomen Black & Grey Self Design Cardigan,2,1,1
995,"Indian Terrain Men's Checkered Casual White, Blue Shirt",51,2,8
996, Brown And Maroon Moss Chiffon And Georgette Saree With Blouse ,33,10,16
997,FLEXIMAA Solid Women V-neck Green T-Shirt,4,4,4
998,Levi's Men's Checkered Casual Red Shirt,42,2,10
999,BareblowMen White Tropical Print Boxers BBBX40XL,1,3,1
1000,Patch border Velvet Lehenga in Red ,33,8,17
1001,V Dot by Van Heusen Solid Single Breasted Casual Men's Blazer,5,16,11
1002,SASSAFRASWomen Off-White & Red Applique Detail Sweatshirt,1,1,1
1003,OxolloxoMen Navy blue Checked Pyjamas W18007MNW002,10,6,6
1004,TABARDMen Blue & White Slim Fit Printed Formal Shirt,1,44,2
1005,Annabelle by Pantaloons Women's Solid Casual Dark Blue Shirt,32,59,43
1006,RSVP CrossWomen Beige Printed Sweatshirt,27,34,25
1007,Pepe Jeans Full Sleeve Graphic Print Men's Sweatshirt,52,10,32
1008,Fashion and Fusion Solid Single Breasted Wedding Men Blazer,101,101,101
1009,RichlookMen Blue Regular Fit Striped Formal Shirt,101,101,91
1010,Monte CarloWomen Black Self Design Cardigan,32,8,15
1011,Puma Graphic Print Women's Round Neck Blue T-Shirt,1,1,1
1012,Ajile by Pantaloons Solid Women's Round Neck Red T-Shirt,101,101,101
1013,Jihuzur Solid Men's Waistcoat,101,101,101
1014,Wear Your Mind Printed Men's Grey Track Pants,101,101,101
1015,DOROTHY PERKINSPeach-Coloured Double-Breasted Casual Blazer,1,1,1
1016,Puma Sleeveless Printed Men's Jacket,1,1,1
1017,Club YorkWomen Olive Green Printed Hooded Sweatshirt,1,2,1
1018,Momin Libas AC16916_163 Poly Crepe Solid Abaya,101,101,101
1019,Miss ChaseWomen Peach-Coloured Solid Hooded Sweatshirt,2,3,2
1020,RichlookMen Yellow & Blue Regular Fit Checked Formal Shirt,23,2,4
1021,Arrow New York Tapered Men Grey Trousers,101,101,101
1022,Beige printed cotton unstitched salwar with dupatta,13,48,15
1023,Mehendi printed crepe semi stitched salwar with dupatta,87,49,64
1024,Being Fab Men's Geometric Print Casual Black Shirt,15,14,13
1025,Pink cotton poly traditional self design kurta pajama,1,3,1
1026, Grey And Maroon Printed Bhagalpuri Silk With Viscose Border Saree With Blouse ,4,7,4
1027,Smokestack Full Sleeve Self Design Men's Jacket,101,101,101
1028,Shaun Printed Men's Grey Track Pants,49,101,61
1029,Nifty Solid Women's Denim Blue Denim Shorts,78,101,92
1030,EnnobleMen White & Grey Striped Boxers ENBBAPLEN29126,3,2,2
1031,Plain Art Dupion Silk Trouser in Yellow,1,1,1
1032,Momin Libas AK1711_377 Polyester Abaya,101,101,101
1033,RoadsterWomen Burgundy Solid Turtle Neck Sweatshirt,2,1,2
1034,Sports 52 Wear Slim Fit Men's Beige Trousers,101,101,101
1035,Puma Printed Women's Round Neck Pink T-Shirt,2,3,2
1036,"Dee Mannequin Solid Women's Dark Blue, Blue, Black Basic Shorts",101,101,101
1037, Maroon And Blue Printed Chanderi Silk Saree With Blouse ,54,48,46
1038,Harpa Casual Short Sleeve Floral Print Women's Dark Blue Top,9,5,8
1039,Uber Urban Regular Fit Men's Brown Trousers,101,101,101
1040,METTLEWomen Beige Self-Design Hooded Padded Jacket,17,3,11
1041,RoadsterWomen Mustard Solid Sweatshirt,6,5,7
1042,Zobello Full Sleeve Solid Men's Denim Jacket,5,4,2
1043, Gift Piper Kalamkari Silk Saree Pattern 2 ,4,25,1
1044,Force Go WearMen Maroon Printed Boxers MFCO-502-PO1,9,7,8
1045,Showoff Floral Print Men's Waistcoat,101,54,101
1046,Drug 7 Regular Fit Men Beige Trousers,101,101,101
1047,United Colors of Benetton Men's Checkered Casual Pink Shirt,1,6,1
1048,Byouth Men's Cargos,101,101,101
1049,Ridge Vogue Slim Men's Dark Blue Jeans,101,101,101
1050,justkartit JK4726 Nida Georgette Solid Burqa With Hijab,101,101,101
1051,Canterbury Solid Men's Dark Blue Sports Shorts,5,13,2
1052,BlackberrysMen Navy Blue Slim Fit Self Design Formal Shirt,71,27,59
1053,"Highlander Men's Printed Casual Maroon, White Shirt",5,39,12
1054,Kook N KeechWomen Black Printed Hooded Sweatshirt,35,9,19
1055,Peter England University Men's Solid Casual Blue Shirt,51,92,42
1056,Park AvenueMen Blue Slim Fit Solid Formal Shirt,67,4,10
1057,U.S. Polo Assn Men Checkered Casual Multicolor Shirt,101,101,101
1058, Red Santoon Georgette Semi Stitched Anarkali Ethnic Suits Semi stitched ,9,10,9
1059,Highlander Regular Fit Men's Dark Blue Trousers,101,101,101
1060,Allen Solly Men's Self Design Casual Pink Shirt,1,4,1
1061,John Players Men Light Blue Jeans,101,101,101
1062,SuperdryWomen Red Solid Hooded Sweatshirt,2,2,2
1063,Newport Slim Men's Light Blue Jeans,5,101,19
1064,IVOCMen Peach-Coloured Comfort Regular Fit Solid Formal Shirt,45,56,44
1065, Navy Blue And Pink Printed Bhagalpuri Silk With Viscose Border Saree With Blouse ,1,3,1
1066,Van Heusen Tapered Men's Blue Trousers,101,101,101
1067,Canary London Full Sleeve Solid Men's Jacket,27,87,7
1068,French Connection Slim Men's Blue Jeans,101,101,101
1069,Admiral Solid Women's Black Sports Shorts,1,1,1
1070,U.S. Polo Assn Men's Polka Print Casual Blue Shirt,21,8,7
1071,Indian poshakh kurta pajama  machine embriodery zari work,8,12,9
1072,S Mark Embroidered Men's White Sports Shorts,1,1,1
1073,Plain Rayon Palazzo in Violet,2,1,1
1074,Rocker Fashions Full Sleeve Solid Men Jacket,101,5,101
1075,URBAN SCOTTISHMen Pink Slim Fit Printed Formal Shirt,101,89,101
1076,ALC Creations Casual Full Sleeve Solid Women's Blue Top,84,28,38
1077,Nike Solid Men's Dark Blue Sports Shorts,101,15,101
1078,John Players Skinny Fit Men Grey Trousers,101,101,101
1079, Georgette Saree By Voovilla (Pink) ,76,101,99
1080, Multicolor Printed Sarees Bhagalpuri Silk Saree With Blouse ,101,20,101
1081,Mast & HarbourWomen Black Solid Mesh Varsity Jacket,13,1,2
1082,Spiritus by Pantaloons Slim Fit Men's Dark Blue Trousers,101,101,101
1083,Fort CollinsWomen Olive Green Quilted Parka Jacket,1,1,1
1084,Roadster Solid Women's Blue Denim Shorts,17,22,18
1085,Monte CarloWomen Pink Solid Sleeveless Hooded Sweatshirt,3,1,2
1086,Lee Regular Men's Light Blue Jeans,10,5,5
1087,Being Fab Solid Women's Blue Basic Shorts,3,10,15
1088,Bandhej Art Silk Straight Suit in Royal Blue,1,2,2
1089,Adam In Style Colate Single Breasted Solid Men's Suit,101,101,101
1090,Mesh Men's Solid Casual Brown Shirt,101,101,101
1091, Green Embroidered Art Silk Semi Stitched Lehenga ,14,23,14
1092,Maroon cotton plain cotton petticoat,1,1,1
1093,DOROTHY PERKINSWomen Black Solid Front-Open Casual Blazer,2,6,2
1094,Human Steps Men's Printed Casual Multicolor Shirt,101,101,101
1095,TrufitWomen Beige Solid Insulator Padded Jacket with Detachable Hood,20,25,24
1096,Raymond Men's Solid Party Purple Shirt,96,10,32
1097,IVOCMen Navy Blue Comfort Regular Fit Solid Formal Shirt,101,101,101
1098,"Ansh Fashion Wear Regular Fit Men's Beige, Grey Trousers",101,15,25
1099,Only Solid Women's Blue Basic Shorts,4,25,8
1100,Embroidered Pure Kota Silk Straight Cut Suit in Black and Red,11,42,20
1101,Ajile by Pantaloons Solid Women's Round Neck Pink T-Shirt,9,16,7
1102,Vero Moda Women's Checkered Casual Yellow Shirt,1,1,1
1103,Veni Vidi Vici Casual Short Sleeve Solid Women's White Top,77,101,101
1104,Jockey Casual Sleeveless Solid Women's Black Top,1,2,1
1105,"69GAL Solid Women Red, Dark Blue Compression Shorts",11,2,3
1106,BlackberrysMen White & Blue Slim Fit Striped Formal Shirt,3,3,3
1107,Asics Solid Men's White Sports Shorts,1,1,1
1108,Hawai WB131 Polyester Self Design Burqa With Hijab,101,7,101
1109,Nautica Men's Blue Trousers,101,101,101
1110,Peach embroidered georgette semi stitched salwar with dupatta,1,3,1
1111,DressBerryWomen Blue Patchwork Denim Jacket,1,3,1
1112,Pepe Jeans Striped Women's Round Neck Black T-Shirt,47,101,64
1113,"Oshano Men's Solid Casual Dark Blue, Dark Blue Shirt",101,101,101
1114,Locomotive Men's Solid Casual Blue Shirt,101,101,101
1115,"Allen Men's Solid Formal Dark Blue, Blue, Light Blue Shirt",101,101,101
1116,Jonney Solid Men's White Regular Shorts,20,4,7
1117,Dennis Lingo Men's Solid Casual Denim Blue Shirt,2,4,3
1118,Grey dupion silk kurta pajama,50,101,64
1119,U.S. Polo Assn Men's Printed Casual Dark Blue Shirt,11,1,5
1120,"Raas Pr??t Casual Sleeveless Solid, Floral Print Women's Yellow, White Top",1,1,1
1121,"TSX Solid Men's Blue Gym Shorts, Basic Shorts, Sports Shorts",41,101,58
1122, Pink And Blue Printed Cotton Silk Saree With Blouse ,5,1,1
1123,Jihuzur Sleeveless Floral Print Men's Jacket,101,101,101
1124,Momin Libas AK12214_310 Kashibo Solid Abaya,101,101,101
1125,Plain Chanderi Silk Anarkali Suit in Pink,3,1,2
1126,Espresso Solid Women's Black Basic Shorts,101,98,101
1127,English NavyMen Purple & White Slim Fit Checked Formal Shirt,22,3,10
1128,PlayboyMen White Printed Boxers PBL19-1P,1,1,1
1129,Heart 2 Heart Solid Women's Black Regular Shorts,101,101,101
1130,Zink LondonWomen Khaki Solid Duster Jacket,5,24,7
1131,Off silk ethnic indian traditional mens festive wear dhoti kurta,5,21,8
1132,IVOCMen Navy Blue & Navy Blue Slim Fit Solid Formal Shirt,99,49,65
1133,Captain America Graphic Print Men's Grey Basic Shorts,1,1,1
1134,ExcaliburMen Assorted Pack of 2 Slim Fit Formal Shirt,27,4,2
1135,RABIYA COLLECTION FRBNBBEL01 NIDA Self Design Abaya,101,58,101
1136,Viva N Diva 19039-Abaya-2 Lycra Self Design Abaya With Hijab,45,7,63
1137,Gant Men's Trousers,101,101,101
1138,justkartit JK4800 Lycra Solid Burqa With Hijab,4,42,5
1139,RABIYA COLLECTION LYCGP70 CRYSTAL LYCRA Solid Burqa With Hijab,101,101,101
1140,Wills Lifestyle Skinny Fit Men Grey Trousers,101,101,101
1141,justkartit JK4784 Quality Lycra Solid Burqa With Hijab,101,95,101
1142,"Platinum Studio Solid Mandarin Casual, Party, Wedding, Festive Men Blazer",101,101,101
1143,CaymanWomen Brown & Beige Self-Design Woollen Cardigan,24,1,13
1144,Peter EnglandMen Blue Nuvo Fit Solid Formal Shirt,101,101,101
1145,Aeropostale Printed Women's Round Neck White T-Shirt,5,2,3
1146,Miss ChaseWomen Mauve Solid Tailored Jacket with Velvet Finish,1,1,1
1147,POISON IVY Women's Checkered Casual Black Shirt,11,24,14
1148,Van HeusenMen Lavender & White Regular Fit Checked Formal Shirt,101,13,34
1149,Lawson Slim Men's Black Jeans,23,25,18
1150, Light Green Hand Woven Art Silk Saree With Blouse ,8,49,22
1151,Park AvenueMen Blue Slim Fit Self Design Formal Shirt,101,13,101
1152, Pink Embroidered Cotton Unstitched Salwar With Dupatta ,97,96,94
1153,Allen Solly Men's Solid Casual Black Shirt,1,1,1
1154,Young Trendz Printed Men & Women Round Neck Black T-Shirt,1,1,1
1155,Nike Printed Women's V-neck Light Blue T-Shirt,1,1,1
1156,"Indian Terrain Men's Checkered Casual Dark Green, Blue Shirt",10,11,7
1157,Sassafras Casual Sleeveless Solid Women's White Top,101,101,101
1158,SF Jeans by Pantaloons Solid Women's Tunic,101,73,101
1159,Arrow Men's Checkered Formal Brown Shirt,101,101,101
1160,Gag Self Design Men & Women Grey Track Pants,101,101,101
1161,Gant Solid Men Orange Boxer Shorts,1,6,2
1162,Plutus Full Sleeve Solid Men's Jacket,1,1,1
1163,London BeeMens White Printed Boxer MLB0180,16,7,11
1164,White silk ethnic indian traditional mens festive wear dhoti kurta,1,2,1
1165, Beige And Black Printed Khadi Silk Saree With Blouse ,5,2,3
1166,ArrowMen Blue Premium Slim Fit Solid Formal Shirt,101,101,101
1167,ReebokWomen Grey Printed Slim Fit COMBAT LIGHTWEIGHT Mixed Martial Arts Sweatshirt,1,1,1
1168,Green embroidered art silk mens kurta pajama,2,2,2
1169,promodWomen Black Solid Single-Breasted Casual Blazer,4,15,7
1170, Triveni Love Is In The Air Embroidery Lehenga Saree 2403 ,55,18,26
1171,AD & AV Regular Fit Men's White Trousers,101,101,101
1172,Jockey Solid Women's V-neck Pink T-Shirt,1,3,1
1173, Purple And Blue Printed Cotton Blend Saree With Blouse ,25,21,16
1174,MadameWomen Red Solid Quilted Jacket,4,1,1
1175,Park AvenueMen Grey Super Slim Fit Self Design Formal Shirt,1,47,4
1176,Van HeusenMen White & Blue Regular Fit Striped Formal Shirt,11,8,6
1177,Harpa Casual Sleeveless Printed Women's Black Top,16,4,13
1178,Secret World Solid Women Beige Cycling Shorts,24,29,22
1179,Stand Out Printed Men & Women Round Neck Green T-Shirt,4,13,4
1180,Momin Libas A 61-14_63 Kashibo Abaya,101,101,101
1181,Hawai WB00075 Lycra Self Design Burqa With Hijab,101,101,101
1182,Free AuthorityMen Blue & Black Printed Regular Fit Marvel Pyjamas,7,1,3
1183,"Dapper Designz Solid Double Breasted Casual, Party Men's Blazer",2,21,3
1184,Contrast pure khadi placket  and  collar.  hand embroidar buttons enhances the look of this elegent kurta,101,101,101
1185,Arrow Sport Regular Fit Men's Beige Trousers,42,101,101
1186,Focus Solid Women's White Basic Shorts,58,19,39
1187,DOROTHY PERKINSWomen Rust Orange Open Front Blazer,4,11,5
1188,BlackberrysMen White & Red Regular Fit Self Design Formal Shirt,64,101,80
1189,Marks & SpencerMen Navy Blue Pack of 3 Solid Boxers,1,1,1
1190,Being Fab Men's Checkered Casual Multicolor Shirt,101,101,101
1191,"John Miller Men's Checkered Casual White, Purple Shirt",60,27,38
1192,The Cotton Company Full Sleeve Solid Men's Sweatshirt,101,101,101
1193, Black Embroidered Georgette Party Wear Saree With Blouse Piece ,8,4,4
1194,styzon BLUE Men Blue Jeans,101,101,101
1195,Burbn Solid Men's Black Chino Shorts,45,101,52
1196,Free AuthoritySweet Dreams Men Black & Pink Printed Marvel Pyjamas 8903346795017,3,1,1
1197,Lafantar Slim Men's Blue Jeans,101,101,101
1198,Solid Color Dupion Silk Dhoti Kurta in White,6,1,1
1199,Nation Polo Club Slim Fit Men's Gold Trousers,101,101,101
1200,D52 Slim Fit Men Yellow Trousers,101,101,101
1201,Art Silk Straight Pant In Beige,3,3,2
1202,MadameWomen Pink Printed Sweatshirt,26,34,26
1203, White Embroiderd Georgette Saree With Blouse ,4,1,2
1204,"Belmarsh Solid Women Black, Blue, Blue, Red Cycling Shorts",52,36,46
1205,"Indian Terrain Men's Checkered Casual Black, Purple Shirt",68,37,42
1206,"Veni Vidi Vici Party Shoulder Strap, Short Sleeve Solid, Stylised, Self Design Women's Black Top",3,1,1
1207,Van HeusenMen Blue Slim Fit Striped Formal Shirt,35,17,15
1208,U.S. Polo Assn. Slim Fit Men's Green Trousers,63,8,23
1209,HarpaWomen Olive Green Solid Sweatshirt,77,101,101
1210,Peter England Sleeveless Solid Men's Sweatshirt,6,4,3
1211,"Just Khatoon ABA000142 Lycra, Chiffon, MIX COTTON Burqa With Hijab",101,101,101
1212,Printed Faux Georgette Circular Lehenga in Yellow,2,1,1
1213, Blue And Green Printed Mysore Silk Saree With Blouse ,83,16,43
1214,Magneto Men's Cargos,101,101,101
1215,Arrow Men's Casual Shirt,101,101,101
1216,JetFire Self Design Men's Waistcoat,101,101,101
1217,Hand Embroidered Art Silk Kurta Set in Wine,41,4,12
1218,"Care plus Solid Women's White, Black, Maroon Cycling Shorts",1,62,1
1219,DressBerryWomen Burgundy Self Design Open Front Jacket,11,1,4
1220,Red polysilk bronze poly silk resham kurta pyjama,51,22,40
1221,Abaya AL1036 Nida & Georgette Self Design Burqa With Hijab,10,101,15
1222,Wills LifestyleMen Maroon Slim Fit Self Design Formal Shirt,1,8,2
1223,DazzioPink Slim Fit Semiformal Shirt,101,101,101
1224,Sweet DreamsWhite & Navy Blue Printed Pyjamas MP-144318COM,14,101,32
1225, Indian Women Yellow Color Two Tone Bright Georgette Saree ,8,3,5
1226, Black Embroidered Georgette Saree With Blouse ,6,5,5
1227,ONLYWhite & Black Striped Casual Front-Open Blazer,3,4,2
1228,Kotty Printed Women's Green Night Shorts,34,4,36
1229, Pink Embroidered Art Silk Semi Stitched Salwar With Dupatta ,10,101,32
1230,SplashBlue Denim Dungarees,41,33,42
1231,Urbano Fashion Solid Men's Light Blue Chino Shorts,1,3,1
