qi,query,rank_a,rank_b,rank_f
411,Momin Libas AK21217 Polyester Solid Burqa,101,21,89
412,Demokrazy Solid Men's Grey Track Pants,101,101,101
413,John Players Regular Fit Men's Beige Trousers,6,37,65
414,"Ap'pulse Solid Women's Round Neck Black, Brown T-Shirt",9,2,5
415,"Belmarsh Solid Women Black, Red, Red, Black Cycling Shorts",4,3,2
416,Kinger Solid Single Breasted Formal Men's Blazer,101,101,101
417,WROGN Men's Self Design Casual White Shirt,14,39,12
418,Jai textiles Men's Solid Casual Yellow Shirt,26,1,8
419,"John Players Men's Self Design Formal White, Purple Shirt",101,101,101
420,SztoriWomen Blue & Grey Colourblocked Hooded Sweatshirt,1,1,1
421,Arv Fashion Casual Full Sleeve Solid Women Red Top,2,101,17
422,Black men's full sleeve kurta pajama,16,5,8
423,Mangal Regular Fit Men's Black Trousers,101,18,23
424,Highlander Men's Solid Casual Purple Shirt,101,101,101
425,Alfa Fashion Party Puff Sleeve Solid Women Maroon Top,33,56,52
426,Routeen Self Design Men's Waistcoat,70,38,83
427,Vego Self Design Men's Dark Green Night Shorts,101,101,101
428,FOREVER 21Women Olive Green Printed Bomber Jacket,13,7,11
429,Gota Patti Art Silk Straight Suit in Royal Blue,10,6,10
430, Beige And Blue Printed Khadi Silk Saree With Blouse ,2,2,2
431,RoadsterWomen Navy Blue & Mustard Yellow Colourblock Hooded Sweatshirt,1,1,1
432,Peter England Men's Printed Casual Dark Green Shirt,44,13,25
433, Orange Zari Georgette Saree With Blouse ,5,4,5
434,Shivam garments Solid Men's Waistcoat,101,101,101
435,Momin Libas AC2114_174 poly crepe Solid Abaya,101,13,34
436,LP Louis Philippe Men's Solid Casual White Shirt,3,1,1
437,Jonney Solid Men's Multicolor Regular Shorts,101,101,101
438,Bdow Fashion Collection Slim Fit Men's Black Trousers,3,3,1
439, Purple Hand Woven Linen Saree With Blouse ,2,8,4
440,Locomotive Skinny Men's Red Jeans,7,4,4
441,Annabelle by Pantaloons Women Geometric Print Casual Maroon Shirt,1,9,3
442,"Ojass Men's Solid Casual White, Blue Shirt",8,1,1
443,Mayra Party Sleeveless Solid Women's Red Top,21,14,19
444,ChemistryWomen Grey Melange Solid Hooded Embellished Sleeve Sweatshirt,1,1,1
445,U.S. Polo Assn Men's Solid Casual Linen White Shirt,1,1,1
446,WellFitLook Solid Men's Grey Track Pants,101,101,101
447,Miss ChaseWomen Maroon Solid Sweatshirt,39,101,68
448,TSX Solid Men's Multicolor Track Pants,101,101,70
449,DressBerryWomen Olive Green Self-Design Tailored Jacket,30,10,18
450,Jack & Jones Skinny Men's Blue Jeans,101,15,57
451,London Bee Dark Green Color Men's Cargos,101,101,101
452, Dark Blue Embroidered Silk Satin Lehenga With Dupatta ,51,68,61
453,"Peter England Men's Checkered Casual Yellow, Brown, Blue Shirt",14,12,10
454,"Beevee Solid Men's Blue Beach Shorts, Gym Shorts, Running Shorts",2,29,3
455,Orange plain artSilk kurtaPyjama,4,2,1
456,JG FORCEMAN Sleeveless Printed Men's Sweatshirt,3,6,3
457, Magenta Embroidered Art Silk Lehenga With Dupatta ,12,30,17
458,Superdry Full Sleeve Solid Men's Sweatshirt,12,9,10
459,HERE&NOWWomen Green Solid Sweatshirt,25,5,10
460,Kenneth Cole Men's Striped Formal Blue Shirt,6,7,2
461,Louis PhilippeMen Charcoal Grey Slim Fit Self Design Formal Shirt,1,3,2
462,Calvin Klein UnderwearCalvin Klein Innerwear Blue & Yellow Checked Slim Fit Boxers U15136AI,1,1,1
463,OVSWomen Black Solid Hooded Sweatshirt,1,3,1
464, Orange Color Jacquard Plain Semi Stitched Lehenga Choli With Blouse ,2,3,1
465,Men's maroon dupionSilk embroidered kurta-pajama wth em broidered jacket,2,1,1
466, Orange Plain Cotton Kalamkari Saree With Blouse ,5,8,4
467, Orange And Red Printed Khadi Silk Saree With Blouse ,7,13,9
468,Brown chanderi embroidered semi stitiched salwar with dupatta semi stitched,11,6,6
469,"Arrow Sport Men's Checkered Casual Blue, Maroon Shirt",17,23,17
470,Routeen Floral Print Men's Waistcoat,15,6,14
471,ADIDAS NEO Printed Men's Black Track Pants,1,1,1
472,Vero Moda Self Design Women Round Neck Maroon T-Shirt,2,5,2
473,Leo SansiniWomen Grey Solid Sweatshirt,91,96,74
474,CottonworldMen Black & Purple Slim Fit Printed Formal Shirt,1,74,3
475, Beige And Green Printed Mysore Silk Saree With Blouse ,3,5,2
476,"U.S. Polo Assn Men's Checkered Casual Red, White, Blue Shirt",101,44,101
477,Kook N Keech MarvelWomen White & Red Colourblocked Sweatshirt,1,1,1
478,Louis PhilippeMen White & Blue Regular Fit Striped Formal Shirt,101,27,87
479,Fort CollinsWomen Pink Solid Open Front Jacket,1,41,1
480,Vero Moda Women's Solid Casual Light Blue Shirt,17,11,14
481,HRX by Hrithik Roshan Women's Solid Casual Black Shirt,2,1,2
482,Obeo Solid Women's Blue Denim Shorts,38,101,37
483,Kotty Animal Print Men's Blue Regular Shorts,24,101,32
484,"S9 Women Printed Women's Dark Blue, Light Blue Basic Shorts",101,101,101
485,HERE&NOWWomen Navy Blue Solid Parka,7,7,5
486,Red Tape Men's Solid Casual Grey Shirt,29,81,101
487,DOROTHY PERKINSWomen Grey Melange Embroidered Hooded Sweatshirt,2,1,1
488,John Players Men Blue Jeans,101,101,101
489,People Printed Women Round Neck Pink T-Shirt,6,11,10
490,AV2 Casual 3/4th Sleeve Printed Women Beige Top,27,51,32
491,ChemistryWomen Maroon Solid Sweatshirt,34,8,18
492,NUSHWomen White Denim Dungarees,4,1,2
493,Blackberrys Men's Formal Shirt,101,101,101
494,ESPRITWomen Red Self Design Cardigan,31,34,32
495,OVSWomen Blue Solid Cardigan,4,101,15
496,"Indigo Nation Printed Men's Brown, Grey Chino Shorts",31,20,21
497,OVSWomen Navy Solid Cardigan,5,6,3
498,AthenaWomen Dusty Pink Printed Hooded Sweatshirt,1,2,1
499,Mast & HarbourWomen Charcoal Grey & Teal Blue Colourblocked Sweatshirt,1,1,1
500,StalkBuyLoveWomen Grey Solid Sweatshirt,101,101,101
501,Eldrino EWB0014 Lycra Self Design Burqa With Hijab,101,101,101
502,Highlander Men's Checkered Casual Red Shirt,101,25,51
503,ElleWomen Black Solid Sweatshirt,101,101,101
504,ArrowMen Pink Slim Fit Solid Formal Shirt,43,23,35
505,Paul London Printed Men's Blue Track Pants,26,101,33
506,"Indian Terrain Men's Checkered Casual Yellow, Blue Shirt",2,9,3
507, Cream And Pink Printed Khadi Silk Saree With Blouse ,5,1,3
508,RABIYACOLLECTION LYCC01 LYCRA CRYSTAL Solid Burqa,101,101,101
509,Wrangler Women Solid Casual Black Shirt,12,8,6
510, Blue Printed Mysore Silk Saree With Blouse ,2,9,3
511,Kenneth Cole Solid Men's Beige Basic Shorts,7,1,1
512,Ed Hardy Slim Fit Men's Brown Trousers,5,1,1
513,One Femme Checkered Women Tunic,8,1,1
514,MadameWomen Orange Solid Hooded Sweatshirt,10,6,10
515,"WellFitLook Cool TrackPant Solid Men's Blue, Blue Track Pants",100,101,82
516,Lawson Skinny Men's Black Jeans,2,7,6
517,Next LookMen Burgundy Slim Fit Self Design Formal Shirt,101,6,101
518,U.S. Polo Assn. TailoredMen Pink & Blue Slim Fit Printed Formal Shirt,101,63,95
519,Wills LifestyleMen Coffee Brown Slim Fit Checked Formal Shirt,1,1,1
520,Modest Forever P125 Poly Moss Abaya,101,101,101
521, Pink Embroidered Georgette Salwar With Dupatta Semi stitched ,71,33,48
522,DressBerryWomen Black Self Design Sweatshirt,7,47,7
523,Svanik Embellished Men Waistcoat,1,56,2
524,AthenaWomen Black & Dusty Pink Colourblocked Hooded Sweatshirt,1,1,1
525,Peter England Slim Fit Men's Brown Trousers,1,8,5
526,Bdow Fashion Collection Slim Men's Brown Jeans,4,5,2
527,HUSTLE Solid Men's Green Track Pants,101,101,101
528, Blue Hand Woven Cotton Saree ,5,14,9
529,Momin Libas AK20617 Polyester Solid Burqa,101,101,101
530,PrimeClub Sleeveless Solid Men's Jacket,101,101,101
531, Rama And Gold Printed Kanjivaram Silk Saree With Blouse ,5,3,3
532,Arrow Men's Printed Casual Grey Shirt,101,101,101
533,Club York Full Sleeve Printed Men's Sweatshirt,1,1,1
534,Meher Impex Casual 3/4th Sleeve Printed Women Multicolor Top,101,101,101
535, Pink And Green Printed Cotton Kota Blended Saree With Blouse ,47,60,45
536,NEVAMen Blue Comfort Regular Fit Self Design Formal Shirt,101,101,101
537,"HUSTLE Printed Men Grey, Black Track Pants",1,1,1
538,ArrowMen Blue Snug Slim Fit Self Design Formal Shirt,101,91,101
539,nowrin B228 Polyster Nidha Abaya With Hijab,101,101,101
540,JG FORCEMAN Regular Fit Men Blue Trousers,101,101,101
541,SztoriWomen Navy Blue Solid Hooded Sweatshirt,1,1,1
542,"United Colors of Benetton Men's Checkered Casual Green, Dark Blue Shirt",11,47,14
543, Pista And Pink Printed Kraft Silk Saree With Blouse ,5,5,4
544,Nike Solid Women's Black Running Shorts,1,1,1
545,THE BEAR HOUSEMen Green Linen Comfort Fit Solid Semiformal Shirt,1,1,1
546,Ajile by Pantaloons Printed Women's Round Neck Black T-Shirt,1,12,1
547, Beige Woven Silk Saree With Blouse ,101,101,101
548,BareblowMen Black Floral Print Boxers BBBX39XXL,1,1,1
549,AND Printed Women's Tunic,78,14,38
550,Van HeusenMen Off-White Contemporary Regular Fit Checked Formal Shirt,11,32,14
551,Momin Libas AKn4414_521 Poly Knit Solid Abaya,101,101,101
552,You Forever Solid Women's Maroon Night Shorts,1,4,1
553,Silk IndiaMen Cream Solid Silk Blend Pyjama,1,1,1
554,"Mesh Men's Solid Formal Green, Purple Shirt",3,2,2
555,FLEXIMAA Solid Women's V-neck Green T-Shirt,1,1,1
556,La Milano Men's Solid Casual Blue Shirt,28,6,24
557,ArrowMen Blue & White Regular Fit Self Design Formal Shirt,101,101,101
558,5TH ANFOLD Men Solid Casual White Shirt,5,27,1
559,U.S. Polo Assn. Slim Fit Men's Brown Trousers,30,7,37
560,Nite Flite Printed Women Pink Night Shorts,2,7,7
561,Forever 21 Casual Full Sleeve Solid Women's Black Top,96,11,41
562,U.S. Polo Assn. WomenTeal Green Embroidered Sweatshirt,1,1,1
563,ONLYWomen White Solid Sweatshirt,6,2,3
564, Ada Hand Embroidered Carrot Pink Cotton Lucknow Chikankari Saree With Blouse ,2,5,4
565,Plain Cotton Mulmul Long Skirt in Maroon,4,4,4
566, Green Net Embroidered Lehenga Choli ,10,6,9
567, Grey Embroidered Pure Georgette Salwar Semi stitched ,16,20,12
568,Park Avenue Slim Fit Men's Brown Trousers,14,39,15
569,Gota Patti Embroidered Cotton Silk Straight Suit in Beige,2,1,1
570,IVOCMen Purple Slim Fit Solid Formal Shirt,101,87,100
571,Flags Regular Men Gold Jeans,101,101,101
572,Abdul Haadi Ml061B-L Poly Cotton Abaya,101,101,101
573,Cotton Silk Straight Pant in Beige,1,1,1
574,MadameWomen Burgundy Self Design Cardigan,3,6,4
575,ADIDAS ORIGINALS Full Sleeve Printed Men's Sweatshirt,4,1,2
576,MANGOWomen Black Solid Denim Jacket,1,15,1
577,Monte CarloWomen Pink Solid Sweatshirt,1,1,1
578,Spykar Men's Solid Casual Dark Blue Shirt,101,96,90
579,Ed Hardy Full Sleeve Printed Men Sweatshirt,101,101,101
580,Clo Clu Women Embroidered Casual Denim Blue Shirt,2,3,3
581,Mayra Casual Sleeveless Solid Women's Yellow Top,31,15,28
582,Wrangler Regular Men's Jeans,32,84,51
583,"Platinum Studio Woven Single Breasted Casual, Formal Men Blazer",92,101,94
584,FOREVER 21Women Black Solid Sweatshirt,7,5,5
585,The Dry State Solid Women's Round Neck Maroon T-Shirt,34,78,43
586,Fort Collins Full Sleeve Printed Men's Sweatshirt,101,37,101
587,United Colors of Benetton Women's Floral Print Casual White Shirt,3,1,1
588,HERE&NOWWomen Navy Blue Solid Padded Jacket,78,13,37
589,Bfly Printed Women's Multicolor Basic Shorts,6,8,9
590,Aeropostale Full Sleeve Solid Men's Sweatshirt,101,101,101
591,DressBerryWomen Mauve Printed Sweatshirt,16,7,9
592,Force Go WearMens Black & Yellow Printed Boxers MFCO502PO1BOXERP24,2,1,1
593,Kritika's World Sleeveless Solid Men's Jacket,50,1,15
594,Modest Forever P122 Heather Moss Abaya,101,101,101
595,Vero Moda Striped Women's Grey Chino Shorts,1,1,1
596,Fasnoya Self Design Women Grey Hotpants,101,101,101
597,Gota Patti Georgette Straight Suit in Blue Ombre,5,5,6
598,Elepants Men's Printed Casual Multicolor Shirt,101,101,101
599,Momin Libas AC8014_219 Poly crepe Solid Abaya,101,101,101
600,Embroidered Dupion Silk Kurta Churidar in Sky Blue,1,1,1
601," Lemon Resham Embroidery,Floral Embroidery,Lace Work And Diamond Stone Salwar Kameez Semi stitched ",8,25,12
602,Van Heusen Printed Men's Waistcoat,49,51,61
603,"AD & AV Regular Fit Men's Grey, Black Trousers",101,101,101
604, Red Plain Silk Saree With Blouse ,33,101,59
605,UNDER ARMOURWomen Blue Colourblocked ColdGear Reactor Half Zip Sporty Jacket,2,19,3
606,2Go Solid Women's Round Neck Pink T-Shirt,4,10,4
607,DOROTHY PERKINSWomen Black & White Solid Cardigan,25,57,28
608,Basics Solid Tuxedo Style Casual Men Blazer,101,101,101
609,ADIDAS NEO Solid Men's Dark Blue Sports Shorts,14,8,11
610,Nautica Men's Dark Blue Trousers,101,72,101
611,Blue cotton snazzy denim thobe,3,3,3
612,james Men's Solid Formal White Shirt,22,40,18
613, Yellow Color Georgette Saree With Blouse ,17,13,15
614,Kotty Solid Men's Black Basic Shorts,101,20,91
615,Viva N Diva 11196-Abaya Lycra Self Design Abaya With Hijab,101,101,101
616,Eavan Solid Women's Denim Blue Denim Shorts,71,101,101
617, Light Pink Printed Sarees Georgette Saree With Blouse ,79,101,88
618,Being Fab Men's Solid Casual Purple Shirt,16,19,10
619,REEBOK Printed Women's Round Neck Blue T-Shirt,4,1,1
620,d52 Slim Fit Men Blue Trousers,101,101,101
621,Camey Polka Print Women Black Regular Shorts,8,26,19
622,I Lead Solid Women's Denim Blue Denim Shorts,101,3,101
623,Amante Solid Women's Red Sports Shorts,13,3,3
624,Spykar Skinny Men's Grey Jeans,25,8,8
625, Red And Orange Printed Mysore Silk Saree With Blouse ,30,21,22
626,Rodid Solid Men's Maroon Track Pants,10,1,3
627, Green And Blue Embroidered Georgette Saree With Blouse ,1,1,1
628, Maroon Printed Sarees Silk Blend Saree With Blouse ,46,19,33
629,Bfly Printed Women's Yellow Hotpants,1,3,2
630,Trendy Trotters Solid Men's Blue Sports Shorts,101,32,56
631,Louis Philippe Suit Solid Men's Suit,97,16,45
632,Cream men's full sleeve kurta pajama,101,46,94
633,STYLISH TROTTERS Regular Men's Beige Jeans,101,52,80
634, Violet Embroidered Moss Chiffon Saree With Blouse ,93,101,96
635,Peter EnglandMen Purple Slim Fit Printed Formal Shirt,48,20,29
636,Annabelle by Pantaloons Women's Printed Formal Black Shirt,3,1,3
637,Men black linen pathani style kurta,2,4,3
638,Momin Libas AK1214_304 Kashibo Solid Abaya,101,101,101
639,Kook N Keech DisneyWomen Black Printed Hooded Sweatshirt,3,1,1
640,John PlayersMen White & Black Slim Fit Printed Formal Shirt,101,60,98
641,"Platinum Studio Solid Mandarin Casual, Wedding, Party Men Blazer",101,101,101
642,Fashion Village1 Women Solid Casual Black Shirt,1,4,4
643, Blue And Purple Printed Cotton Blend Saree With Blouse ,65,48,53
644,vero lie Men's Solid Casual White Shirt,76,101,101
645,Momin Libas AK18217 Polyester Solid Burqa,101,101,101
646,U.S. Polo Assn Men's Casual Shirt,14,4,3
647, Blue Puneri Saree Puneri Silk Saree With Blouse ,3,101,59
648,Next LookMen Yellow Slim Fit Printed Formal Shirt,1,2,1
649,Vero Moda Solid Women's Pink Basic Shorts,101,101,101
650,Momin Libas AK15716_353 Kashibo Solid Abaya,101,24,101
651,Aeropostale Printed Women Round Neck Red T-Shirt,62,85,60
652,Nike Printed Women's Orange T-Shirt,4,1,2
653,"FLEXIMAA Solid Women's V-neck White, Black T-Shirt",1,1,1
654, Light Pink Digital Print Cambric Salwar Unstitched ,10,22,10
655,RoadsterWomen Charcoal Solid Hooded Crop Sweatshirt,10,78,26
656,ChemistryWomen Green Ruffle Detail Sweatshirt,1,1,1
657,Miss ChaseWomen Black & Yellow Solid Sweatshirt,16,9,15
658,CaymanWomen Brown Self Design Cardigan,4,2,3
659,Peter EnglandMen Maroon Slim Fit Checked Formal Shirt,7,27,10
660,Van HeusenMen Purple & Blue Two-Toned Custom Slim Fit Formal Shirt,4,101,17
661,"TAG-7 Self Design Tuxedo Style Casual, Festive, Party, Wedding Men Blazer",19,101,71
662,"Belmarsh Solid Women Blue, White, Blue, White Cycling Shorts",7,6,3
663,Marks & SpencerWomen Navy Blue & White Self-Design Open Front Jacket,9,1,2
664,John Miller Slim Fit Men's Beige Trousers,101,101,101
665, Pink Embroidered Two Tone Chiffon Pattern Saree With Blouse ,98,101,98
666,Louis Philippe Men's Checkered Formal Blue Shirt,13,8,9
667,REEBOK Printed Women's Round Neck Purple T-Shirt,2,1,1
668,Shaurya-F Slim Fit Men Brown Trousers,101,101,101
669,Pepe Jeans Solid Men's Waistcoat,2,35,3
670, Pink Embroidered Georgette Net Salwar Suit With Dupatta Semi stitched ,21,46,29
671,Solid Color Cotton Linen Kurta in Light Pink,1,2,1
672,Plain Art Silk Jacquard Kurta Set in Peach,7,20,13
673,PANITWomen Black Solid Open Front Jacket,27,21,18
674,Park AvenueMen Beige Slim Fit Printed Formal Shirt,4,1,2
675,Chimpaaanzee Party Short Sleeve Solid Women's Black Top,4,15,6
676,69GAL Printed Women's Multicolor Night Shorts,101,101,101
677,Blue cotton jute nehru jacket,101,6,14
678, Pink Printed Satin Saree With Blouse ,39,101,66
679,SASSAFRASWomen Navy Blue Double-Breasted Casual Blazer,25,8,13
680,Embroidered Banarasi Silk Anarkali Suit in Fuchsia,3,3,2
681,Van Heusen Sport Slim Fit Men's Beige Trousers,101,101,101
682, Green Fox Crape Digital Print And Embroidery Semi Stitched Salwar With Dupatta Semi stitched ,101,101,101
683,SASSAFRASWomen Black Solid Cold-Shoulder Sweatshirt,2,23,8
684,Cafley Men's Solid Formal Maroon Shirt,101,101,101
685,Solid Color Art Silk Pant in Wine,11,12,7
686,Peter England EliteMen White Regular Fit Checked Formal Shirt,101,101,101
687,Van HeusenMen Beige Regular Fit Checked Formal Shirt,4,8,4
688,"Fashion Line Solid Women's Pink, Purple, Grey Cycling Shorts",1,33,1
689,Wisstler Printed Women Blue Hotpants,101,101,101
690,athelete Men's Cargos,101,101,101
691,"Dee Mannequin Solid Men's Black, Grey Track Pants",101,101,101
692, Orange Embroidered Viscose Rayon Saree With Blouse ,101,101,101
693,Tokyo TalkiesWomen Brown Solid Biker Jacket,26,63,39
694,ADIDAS NEO Men's Shorts,1,1,1
695,Campus SutraWomen Black & Blue Colourblocked Varsity Jacket,1,1,1
696,"Belmarsh Solid Women White, Blue, Black, Blue Cycling Shorts",16,32,16
697,Tie Dyed Sleeve Chanderi Silk Pakistani Suit in Peach,1,3,2
698,Maroon kurta set with cording all over and sripes in the placket with cording on the placket  and collar,14,9,11
699,ONLYWomen Grey Solid Hooded Sweatshirt,20,11,13
700,Feroze embroidered jacquard mens kurta pajama,7,21,11
701,CaymanWomen Black Self Design Woollen Longline Cardigan,1,1,1
702,"Green stone worked net,velvet lehenga saree with blouse",4,10,3
703,Van HeusenMen Maroon & Blue Regular Fit Checked Formal Shirt,75,13,36
704,Veirdo Solid Men's Waistcoat,47,3,10
705,RABIYA COLLECTION LYDWL01 lycra Solid Abaya,101,101,101
706,CaymanWomen Olive Green Self Design Woollen Cardigan,10,7,9
707,"Indian Terrain Men's Checkered Casual Grey, Maroon Shirt",3,1,1
708,Jealous Casual Short Sleeve Printed Women Purple Top,4,2,3
709,Green artSilk artSilk semiStitched straight ethnic-suits semi stitched,101,101,101
710,OVSMen Purple Regular Fit Checked Formal Shirt,70,35,44
711,Cult Fiction Solid Women's Round Neck Blue T-Shirt,101,50,101
712,Modish Vogue Geometric Print Women's Multicolor Culotte Shorts,2,21,2
713,White cotton dry fitter beige and white thobe,2,1,1
714,HPS Sports Solid Men Black Track Pants,24,101,72
715,Allen SollyMen Maroon Slim Fit Checked Casual Shirt,2,1,1
716,Burdy Sleeveless Solid Men's Sweatshirt,101,101,101
717,"Softrose Solid Women's Light Blue, Purple Cycling Shorts",5,18,7
718,Leo SansiniWomen Black & Off-White Printed Sweatshirt,42,63,42
719,ChennisMen Blue Slim Fit Solid Formal Shirt,101,19,49
720, Yellow Printed Jersey Cotton Semi Stitched Salwar With Dupatta ,29,40,31
721,Embroidered Cotton Silk Straight Suit in Peach,21,25,24
722,Solid Color Dupion Silk Dhoti Kurta in Royal Blue,11,1,3
723, A Classical Green Red Georgette Suit With Heavy Embroidery Ss0902 ,5,9,5
724,2Go Solid Women's Round Neck Light Green T-Shirt,8,1,1
725,Tokyo Talkies Casual 3/4th Sleeve Printed Women's Pink Top,2,7,1
726,DOROTHY PERKINSWomen Grey Solid Cardigan,10,11,9
727,YASMIN CREATIONS Women's Solid Casual Denim Dark Blue Shirt,2,5,3
728,Frenchtrendz Solid Women's Black Chino Shorts,101,101,101
729,U.S. Polo Assn Women Printed Casual Purple Shirt,7,4,4
730,PannkhWomen Green Embroidered Tailored Fit Front Open Casual Blazer,2,2,2
731,XnYBlack & White Houndstooth Print Sweathshirt,1,1,1
732,"Belmarsh Solid Women Red, Blue, Red, White Cycling Shorts",16,9,10
733, Beige Embroidered Net Unstitched Lehenga Choli ,10,10,10
734, Maroon Embroidered Georgette Saree With Blouse ,29,29,27
735,Hotfits Graphic Print Men's Light Blue Basic Shorts,29,11,20
736, Off White Banarsi Silk A Line Semi Stitched Lehenga Choli ,21,16,15
737,Campus SutraWomen Blue Solid Lightweight Sporty Jacket,5,14,5
738,ArrowMen Blue Regular Fit Printed Formal Shirt,2,10,1
739,Campus Sutra Women Solid Casual Denim Blue Shirt,10,1,1
740,Embroidered Georgette Straight Suit in White,6,1,4
741,Arrow Sport Slim Fit Men's Black Trousers,53,101,42
742,People Women Solid Casual Green Shirt,20,2,10
743,Just Khatoon ABAD2000108 Chiffon Mix Cotton Burqa With Hijab,101,101,100
744,THE ARCHER Solid Men Multicolor Track Pants,101,101,101
745,Obeo Solid Women's Black Denim Shorts,14,27,14
746,RoadsterWomen Coffee Brown Solid Biker Jacket,4,8,5
747, Multi Printed Bhagalpuri Saree With Blouse ,21,9,12
748," Beige Resham Embroidery,Floral Embroidery,Lace Work And Diamond Stone Salwar Kameez Semi stitched ",1,20,7
749,"Just Khatoon ABAD2000102 Lycra, Chiffon Burqa With Hijab",101,101,101
750,WranglerWomen Black Solid Hooded Sweatshirt,1,1,1
751,Southbay Full Sleeve Solid Men's Denim Jacket,101,101,101
752,Finesse Solid Women's Black Hotpants,101,27,77
753,DEPLO Sleeveless Solid Men's Jacket,101,101,101
754,MABISH by Sonal JainMABISH Woman Peach-Coloured Slim Fit Solid Single-Breasted Smart Casual Blazer,2,2,1
755,BlackberrysMen Purple Slim Fit Solid Formal Shirt,1,38,5
756,Being Fab Men's Solid Formal Pink Shirt,96,11,25
757,AACME Full Sleeve Solid Men & Women Sweatshirt,101,101,101
758,DressBerryWomen Grey Solid Padded Jacket,1,4,1
759,Nuevo EstiloWomen Navy Blue Solid Hooded Parka,3,10,3
760,John Players Slim Men's Blue Jeans,101,46,101
761,Hangup Single Breasted Solid Men's Suit,65,101,99
762,John Players Men's Solid Formal Purple Shirt,101,101,101
763,"Rajindras Solid Single Breasted Formal, Party Men's Blazer",101,101,101
764,ArrowMen Rust Regular Fit Solid Formal Shirt,2,3,2
765,Nick&JessMen Blue Printed Boxers MNSBXR008CAXXL,5,10,5
766,Scott International Full Sleeve Solid Men's Jacket,13,101,32
767, Super Net Saree Attached Brocket Border And Blouse 429 ,28,34,21
768,Red embroidered cotton salwar semi stitched,2,11,2
769,FOREVER 21Women Olive Green & Black Printed Cropped Sweatshirt,1,1,1
770,Showoff Graphic Print Men's Waistcoat,5,1,1
771,Allen Solly Regular Fit Men's Blue Trousers,101,101,101
772,Yellow artSilk artSilk semiStitched straight ethnic-suits semi stitched,101,101,101
773,V DotMen Navy Blue Slim Fit Printed Formal Shirt,17,25,20
774,United Colors of Benetton. Men's Printed Casual Pink Shirt,1,2,1
775,Hand Embroidered Chanderi Cotton Straight Suit in Dark Blue,1,2,1
776,London BeeMen Pack of 3 Boxers MLBCP30074,23,15,8
777,Men maroon cotton silk kurta and pyjama set,14,5,14
778,Louis PhilippeMen Blue Classic Fit Printed Formal Shirt,12,21,11
779,Rakshita Collection Sleeveless Solid Men's Quilted  Jacket,80,101,85
780,SASSAFRASWomen Dusty Pink Printed Sweatshirt,4,4,5
781,John Players Slim Fit Men's Dark Green Trousers,27,5,24
782,Burbn Checkered Men Green Chino Shorts,29,2,12
783,Mast & HarbourBlue Single-Breasted Blazer,11,1,1
784,16 Always Multicoloured Crepe Anarkali Kurti,6,10,6
785,Urbano Fashion Slim Men's Light Blue Jeans,57,101,79
786, Blue And Gold Patch And Embellished Desigen Silk Jacquard Saree With Blouse ,1,2,1
787,Born Free 02 Men's Cargos,101,101,101
788,BareblowMen Maroon & Blue Printed Boxers BBBX45XXL,1,2,1
789,"Belmarsh Solid Women Black, Black, Blue, White Cycling Shorts",17,30,11
790,"Vimal Solid Men's Grey, Black Track Pants",54,43,36
791,HancockMen Grey & Blue Slim Fit Checked Formal Shirt,101,101,101
792,Plus Creations Pink Georgette A-line Kurti,26,29,23
793,justkartit JK4739_Rust Lycra Burqa With Hijab,6,25,10
794,Monte CarloWomen Red & Grey Self-Design Sweatshirt,96,9,33
795,Kalt Casual 3/4th Sleeve Solid Women's Grey Top,1,1,1
796,Purple embroidered net saree with blouse,82,26,49
797,Secret World Solid Women Blue Hotpants,101,53,101
798,Indian poshakh grey art silk kurta pajama,5,4,4
799,Mayra Party Sleeveless Solid Women's Blue Top,1,4,6
800,Cult Fiction Solid Women's Round Neck Grey T-Shirt,2,5,5
801,GDS Solid Women's White Basic Shorts,45,6,23
802, Fabron Navy Blue Embroidered Semi Stitched Lehenga Choli Material With Matching Net Dupatta ,35,7,23
803,Being Fab Men's Solid Casual White Shirt,101,101,101
804,Nayyara Couture 5187-M Crepe Georgette Solid Abaya With Hijab,101,101,101
805,Yellow embroidered cotton straight suits wtih dupatta semi stitched,18,7,13
806,Demokrazy Full Sleeve Printed Men's Sweatshirt,101,101,101
807,RoadsterWomen Navy Blue Self Design Cardigan,1,1,1
808,"Teesort Graphic Print, Solid, Striped Men Grey Track Pants",21,3,6
809,V.Dot by Van Heusen Slim Men's Black Jeans,101,101,101
810,ExcaliburMen Assorted Pack of 2 Regular Fit Formal Shirt,59,39,13
811,V DotMen Black & White Slim Fit Printed Formal Shirt,6,7,4
812,WROGN Slim Fit Men's Brown Trousers,101,101,101
813,Van HeusenMen Purple & Grey Slim Fit Printed Formal Shirt,101,101,101
814,Mr Button Solid Mandarin Casual Men Blazer,58,56,55
815,Embroidered Cotton Straight Cut Suit in Black ,12,10,8
816, Orange Silk Saree With Blouse ,101,101,101
817,Plain Bhagalpuri Silk Circular Lehenga in Blue,1,1,1
818,"Belmarsh Solid Women White, Red, White, Blue Cycling Shorts",8,3,5
819,Plain Rayon Patiala in Yellow,1,4,3
820,John Miller Hangout Men's Checkered Casual Blue Shirt,50,36,70
821,RoadsterWomen Navy Solid Hooded Parka Jacket,2,2,2
822,Tommy Hilfiger Slim Men's Blue Jeans,101,101,101
823,Peter EnglandMen Blue Slim Fit Self Design Formal Shirt,37,101,62
824,Miss Chase Party Short Sleeve Solid Women's Maroon Top,19,8,16
825,Srota Full Sleeve Solid Men's Reversible Sweatshirt,101,24,101
