qi,query,rank_a,rank_b,rank_f
1232,Van HeusenMen White Comfort Regular Fit Printed Formal Shirt,101,101,101
1233, Ada Hand Embroidered Blue Cotton Lucknow Chikankari Saree With Blouse ,3,2,2
1234,Embroidered Dupion Silk Kurta Pyjama in Dark Green,1,1,1
1235,Amoya Casual Sleeveless Solid Women's Multicolor Top,101,101,101
1236,RoadsterWomen Green Solid Cardigan,1,1,1
1237,Showoff Sleeveless Printed Men Jacket,101,22,51
1238,Showoff Solid Men's Black Chino Shorts,2,5,2
1239,"Highlander Men's Checkered Casual Red, Dark Blue Shirt",3,29,4
1240,"American Noti Slim Fit Men Yellow, Orange Trousers",5,2,3
1241,Deeksha Men's Solid Casual Red Shirt,42,101,61
1242,Fila Printed Men's Multicolor Sports Shorts,7,2,4
1243,Ben Martin Regular Men's Light Blue Jeans,101,35,101
1244,Modest Forever P156 Heather Moss Abaya,101,101,101
1245,Foreign Culture By Fort CollinsWomen Black Solid Parka Jacket with Hood,8,5,6
1246,Allen Solly Women Solid Formal Pink Shirt,1,37,6
1247,Rodid Men's Solid Casual Dark Blue Shirt,4,3,1
1248, Green Embroidered Chiffon Saree With Blouse ,29,24,28
1249,Sports 52 Wear Full Sleeve Solid Men's Reversible Sweatshirt,101,101,101
1250,Van HeusenMen Yellow Regular Fit Printed Formal Shirt,90,101,93
1251,"LANCE Solid Men's Black, Grey Track Pants",71,6,16
1252,John Players Men's Solid Formal White Shirt,101,96,90
1253,Blue printed cotton stitched salwar with dupatta,38,101,54
1254,TexcoWomen Mustard Casual Single-Breasted Blazer,2,3,2
1255,TexcoWomen White & Black Printed Slim Fit Single-Breasted Casual Blazer,1,2,1
1256,"Whimsical Solid Mandarin Wedding, Party, Festive Men's Blazer",3,101,28
1257,Moda RapidoWomen Black Solid Parka,19,19,21
1258,Justkartit JK4741 Lycra Solid Burqa With Hijab,101,101,81
1259, Green And Red Printed Cotton Blend Saree With Blouse ,9,4,7
1260,Indian poshakh white cotton linen kurta pajama,10,5,7
1261,U.S. Polo Assn Slim Fit Men's Brown Trousers,101,72,92
1262,Gant Slim Fit Men's Green Trousers,43,17,27
1263, Beige Embroidered Georgette Semi Stitched Anarkali Salwar With Dupatta ,1,1,1
1264,Justkartit JK4743 Lycra Burqa With Hijab,101,101,101
1265,ChemistryWomen Navy Blue Floral Printed Sweatshirt,2,3,2
1266,Jihuzur Sleeveless Printed Men's Jacket,101,101,101
1267,Marks & SpencerWomen Black Velour Finish Hooded Sweatshirt,9,48,15
1268, Black And White Printed Bhagalpuri Silk With Banarasi Border Saree With Blouse ,1,1,1
1269,ChemistryWomen Rose Gold Solid Biker Jacket,1,1,1
1270,AKSWomen Teal Blue & Golden Printed Longline Ethnic Jacket,1,1,1
1271,Sofias (Ascm-006_Black_Free Size) Cystal Lycra Fabric women's Abaya With Hijab,101,18,70
1272,Showoff Men's Solid Casual Pink Shirt,54,20,43
1273,Justkartit JK4590 Lycra Solid Burqa With Hijab,58,33,22
1274,Cloak & Decker by Monte CarloWomen Red Printed Sweatshirt,52,3,11
1275, Orange And Blue Printed Mysore Silk Saree With Blouse ,3,5,2
1276,HERE&NOWWomen Navy Blue Solid Cardigan,5,12,9
1277,THE BEAR HOUSEMen White Modern Slim Fit Checked Semiformal Shirt,2,4,2
1278,JG FORCEMAN Regular Fit Men Light Blue Trousers,101,101,101
1279, Magenta Silk Saree With Blouse ,25,1,4
1280,Blackberrys Regular Fit Men's Blue Trousers,101,101,101
1281,Dennis Lingo Men's Solid Casual Black Shirt,101,101,101
1282,DressBerryWomen White Self Design Sheer Bomber,1,1,1
1283,Jonney Striped Men's Purple Regular Shorts,3,1,2
1284,U.S. Polo Assn. Checkered Single Breasted Casual Men's Blazer,101,101,100
1285,BlackberrysMen Navy Slim Fit Self Design Formal Shirt,8,2,1
1286,Vero Moda Casual Sleeveless Self Design Women's White Top,39,3,19
1287,Aurro Solid Men's Waistcoat,101,101,101
1288,GivoMen Cream-Coloured Slim Fit Self Design Formal Shirt,57,41,39
1289,Greenhouse Solid Men Black Basic Shorts,101,101,101
1290,"Belmarsh Solid Women Dark Blue, Black, Dark Blue Cycling Shorts",42,14,21
1291,Reevolution Solid Men Waistcoat,101,101,101
1292,Highlander Men's Solid Casual Red Shirt,101,61,101
1293,Van HeusenMen Blue & White Slim Fit Checked Formal Shirt,22,43,23
1294,Sofias (Jd-007_Black_Free Size) Al Nida Fabric women's Abaya With Hijab,101,101,101
1295,Crimsoune ClubWomen Navy Blue Printed Sweatshirt,3,9,3
1296,2GO Solid Men's Black Sports Shorts,1,17,1
1297,Peter England Men's Solid Formal Beige Shirt,58,37,49
1298,Louis Philippe Regular Fit Men's Brown Trousers,99,101,101
1299,John Players Men Dark Blue Jeans,101,101,101
1300,Van Heusen Sport Slim Fit Men's Brown Trousers,101,101,101
1301, Blue Embroidered Organza Saree With Blouse ,9,7,7
1302, Beige Pure Silk A Line Semi Stitched Lehenga Choli ,17,13,14
1303,Embroidered Straight Cut Suit In Green,29,12,18
1304,Rock.it Solid Men Black Sports Shorts,85,25,33
1305,GivoMen Blue Slim Fit Printed Formal Shirt,2,33,5
1306,Iralzo Solid Women's Denim Blue Denim Shorts,101,101,101
1307,Wills Lifestyle Men's Beige Trousers,101,101,101
1308,Bdow Fashion Collection Slim Men's Yellow Jeans,6,2,2
1309,Van HeusenMen Pink Regular Fit Printed Formal Shirt,19,4,16
1310,United Colors of Benetton Printed Women's Polo Neck Yellow T-Shirt,1,1,1
1311,Wrangler Full Sleeve Solid Men's Sweatshirt,101,63,99
1312, Green Color Net Embroidered Semi Stitched Lehenga Choli With Blouse ,1,4,1
1313,Next LookMen Brown & Burgundy Regular Fit Printed Formal Shirt,101,101,101
1314,OxolloxoWomen Red Solid Hooded Sweatshirt,5,3,5
1315,RoadsterBeige Dungarees,2,1,1
1316,Van HeusenMen Navy Blue Contemporary Regular Fit Printed Formal Shirt,8,41,14
1317,Campus Sutra Men's Checkered Casual Multicolor Shirt,22,1,3
1318,Solid Color Cotton Palazzo in Black,7,3,5
1319,Frenchtrendz Casual Roll-up Sleeve Polka Print Women's Orange Top,7,1,2
1320,Fort CollinsWomen Blue Solid Parka Jacket,2,2,2
1321,Hand Embroidered Georgette Straight Suit in Sky Blue,15,6,13
1322,WildcraftWomen Blue Printed Hooded Sweatshirt,6,2,4
1323,Triveni floralmotif embroidered stylish lehenga saree 3011,48,70,54
1324, Orange Patch And Embellished Desigen Silk And Jacquard Saree With Blouse ,3,7,3
1325,ArrowMen Yellow Premium Slim Fit Checked Formal Shirt,1,6,2
1326, Eye Catching Churidar Set ,101,51,94
1327,Garun Solid Men's Waistcoat,101,101,101
1328, Pink Double Layered Net Semi Stitched Lehenga Choli Material With Matching Net Dupatta ,8,10,8
1329,"Fashion Line Solid Women's Black, Green, Purple Cycling Shorts",1,2,1
1330, Maroon Embroidered Net Semi Stitched Lehenga ,43,35,34
1331,Texco Casual Full Sleeve Printed Women's Multicolor Top,101,101,101
1332, Sea Green Embroidered Silk Saree With Blouse ,7,20,11
1333,OxolloxoMen Navy blue & White Checked Pyjamas,7,1,3
1334,Adidas OriginalsWomen Yellow Solid SST TT Sporty Jacket,1,1,1
1335,Peter EnglandMen White Slim Fit Solid Semiformal Shirt,101,76,76
1336,FLEXIMAA Solid Women's Round Neck Purple T-Shirt,1,3,1
1337,2GOWomen Black Solid Lightweight Sporty Jacket,45,101,39
1338,Copper silk ethnic indian traditional mens festive wear dhoti kurta,1,1,1
1339,Forever 21 Solid Women Light Green Basic Shorts,4,4,3
1340,Cream dupion kurta with all over blue machine embroidery with cording on jabba patti and buttons,3,40,8
1341,Drama SistersBlue Checked Flannel Waistcoat,1,11,1
1342,John Miller Men's Jacket,101,101,101
1343,LeeWomen Black Solid Longline Puffer Jacket,2,3,3
1344,Off white cotton plain cotton petticoat,1,1,1
1345,"Trendy Trotters Regular Men's Green, Dark Blue Jeans",101,11,24
1346, Beige Printed Crepe Saree With Blouse ,1,1,1
1347,Notyetbyus Solid Women's Dark Blue Basic Shorts,49,98,48
1348,"sampy Solid Men & Women Dark Blue Sports Shorts, Basic Shorts, Gym Shorts, Night Shorts, Cycling Shorts, Running Shorts",15,1,3
1349, Beige Red Embroidered Brasso Party Wear Saree With Blouse Piece ,13,6,10
1350,ESPRITWomen Black Self Checked Single-Breasted Casual Blazer,23,101,58
1351,Momin Libas AK17416_394 Polyester Abaya,101,101,79
1352,TRINITY JEANS COMPANY Solid Men's Black Track Pants,101,101,101
1353,MadameWomen Brown Solid Varsity Jacket,1,2,1
1354,Modest Forever P132 Poly Moss Abaya With Hijab,101,101,101
1355,Beevee Solid Men's Blue Denim Shorts,56,68,54
1356,Miss GraceWomen Beige Self Design Hooded Sweatshirt,1,1,1
1357, Maroon Embroidered Twill Georgette Saree With Blouse ,9,9,7
1358,DIVE Solid Men's Black Sports Shorts,101,101,101
1359,"Gag Wear Solid Men & Women Black, Light Blue Sports Shorts",2,11,3
1360,Fugazee Solid Men's Black Track Pants,33,7,10
1361, Royal Blue And Beige Printed Bhagalpuri Silk Saree With Blouse ,1,1,1
1362,U.S. Polo Assn Sleeveless Solid Men Jacket,101,76,94
1363,AANIA Casual 3/4th Sleeve Embroidered Women Orange Top,1,1,1
1364,"KNIT ABC Garments Solid Women's Pink, Light Blue Sports Shorts, Cycling Shorts",4,33,6
1365,"Shaun Printed Men's Red, Pink, Grey Track Pants",1,1,1
1366,ArrowMen Blue Regular Fit Solid Formal Shirt,4,1,2
1367,THE 9192 Multicoloured Rayon Anarkali Kurti,4,6,2
1368,Momin Libas A 110-14_31 Polycrepe Abaya,101,101,101
1369,Jealous Club 21 Casual Sleeveless Printed Women Light Blue Top,11,5,6
1370,Batman Full Sleeve Graphic Print Men's Sweatshirt,1,1,1
1371,Forever 21 Solid Women's Grey Skort,1,21,2
1372, Multicolor Printed Cotton Silk Saree With Blouse ,7,26,8
1373, Indian Women Vine Color Two Tone Silk Fabrics Saree ,101,101,89
1374,Abaya AL1025 Crepe Self Design Burqa,101,101,101
1375,BlackberrysMen Black Slim Fit Self Design Formal Shirt,32,11,15
1376,PeopleWomen Olive Green Solid Hooded Sweatshirt,21,8,11
1377,Allen Solly Men's Checkered Casual Green Shirt,53,6,27
1378,"Clo Clu Solid Women Round Neck Yellow, Black T-Shirt",1,1,1
1379, Violet Lycra And Marble Chiffon Saree With Blouse ,101,101,101
1380,Indian poshakh royal blue doby dupion kurta pajama,6,14,9
1381,Wisstler Graphic Print Women's Multicolor Hotpants,101,48,101
1382,Monte CarloWomen Green Solid Hooded Sweatshirt,101,22,101
1383,Hawai WB00296 Lycra Self Design Burqa With Hijab,101,56,101
1384,Nifty Solid Women's Denim Light Blue Denim Shorts,28,85,45
1385,Van HeusenMen Beige Slim Fit Self-Design Formal Shirt,2,4,3
1386, Multicolor Digital Print Tussar Stitched Salwar With Dupatta ,97,40,95
1387,"Belmarsh Solid Women Red, Blue, Black, Red Cycling Shorts",22,39,25
1388,"Belmarsh Solid Women Blue, White, Blue, Red Cycling Shorts",9,14,11
1389,TABARDMen Blue Semi Slim Fit Checked Formal Shirt,101,101,101
1390,Campus Sutra Casual Half Sleeve Printed Women White Top,27,52,92
1391,"2GO Solid Men Grey, Black Track Pants",1,3,1
1392,Marks & SpencerWomen Charcoal Grey Checked Single-Breasted Casual Blazer,6,89,21
1393,Asics Solid Men Black Sports Shorts,101,26,61
1394,Men pink cotton mid length kurta,3,1,1
1395,Peter EnglandMen Pink & Blue Slim Fit Checked Formal Shirt,14,2,5
1396,DESIGN CLASSIC Solid Men Black Track Pants,18,14,13
1397, designer red gajri chiffon indian bridal spectacular lehenga saree,2,1,1
1398,EnnobleMen Navy-Blue & White Printed Boxers ENBBAPLEN29077,18,2,5
1399, Cream Printed Georgette Saree With Blouse ,24,14,16
1400,FOREVER 21Women Peach-Coloured Solid Sweatshirt,31,49,33
1401,Beevee Regular Fit Men's Grey Trousers,97,87,51
1402,Van HeusenMen Red Slim Fit Self Design Formal Shirt,101,101,101
1403,TSX Solid Men's Green Track Pants,17,33,28
1404,OkaneWomen Off-White & Grey Self-Design Single-Breasted Suede Finish Casual Blazer,3,1,1
1405,BareblowMen Turquoise Blue & White Checked Boxers BBBX41L,4,5,4
1406,RoadsterWomen Burgundy Solid Hooded Velvet Sweatshirt,3,6,4
1407,Vintage Soul Men's Floral Print Casual Blue Shirt,9,8,7
1408,"james Men's Solid Formal Black, Light Blue, White Shirt",2,8,2
1409,"METCARE Solid Men Grey, Orange Track Pants",5,1,2
1410,Adidas Solid Men's White Sports Shorts,1,3,1
1411, Chhabra 555 Blue Embroidered Art Silk Heavy Work Saree With Blouse ,32,41,31
1412,Louis PhilippeMen White Regular Fit Solid Formal Shirt,70,101,101
1413,Abhivani blue color chinese collar kurta & pant for men,101,101,99
1414,RABIYA COLLECTION LYCEM77 LYCRA CRYSTAL Solid Burqa With Hijab,101,101,101
1415,CaymanWomen Brown Self Design Woollen Cardigan,10,7,7
1416,PannkhWomen Multi-Coloured Printed Tailored Fit Single-Breasted Blazer,2,3,1
1417,Embroidered Chanderi Silk Straight Suit in Creme,10,17,11
1418,Candy House Solid Men's Multicolor Sports Shorts,101,74,99
1419,aLLMen Grey Regular Fit Self Design Formal Shirt,16,101,73
1420,Peter England EliteMen Charcoal Grey Slim Fit Striped Formal Shirt,101,101,101
1421,Beevee Solid Men's Black Bermuda Shorts,101,101,101
1422,Wills LifestyleMen Peach-Coloured Regular Fit Self Design Formal Shirt,25,20,22
1423, Green And Mehendi Printed Synthetic Unstitched Salwar With Dupatta ,1,1,1
1424,Force Go WearMens Pack of 2 Checked Pyjamas MFCO-551,3,3,3
1425,Arrow Sport Men's Checkered Casual Grey Shirt,6,1,1
1426,U.S. Polo Assn Full Sleeve Striped Men's Sweatshirt,3,7,8
1427, Dark Mustard Puneri Saree Puneri Silk Saree With Blouse ,101,101,101
1428,Elepants Men's Solid Casual Yellow Shirt,43,9,20
1429,Peter EnglandMen Pink Regular Fit Printed Formal Shirt,16,10,13
1430,ArrowMen Blue Regular Fit Solid Casual Shirt,101,89,101
1431,Indian poshakh kurta pajama with velvet,12,15,9
1432,DressBerryMove Women Black Printed Sweatshirt,14,15,11
1433,Rodid Full Sleeve Solid Men's Denim Jacket,15,1,2
1434,Momin Libas AK14414_329 Kashibo Solid Abaya,101,101,101
1435,Arrow New York Men's Printed Casual Grey Shirt,88,39,60
1436,"Wolf Casual Sports Solid Men's Black, Red Track Pants",15,101,38
1437,Printed Straight Cut Bhagalpuri Silk Suit in Beige,13,1,2
1438,RoadsterWomen Teal Blue Printed Hooded Sweatshirt,1,1,1
1439,Jack & Jones Men's Checkered Casual Linen Blue Shirt,101,17,57
1440,Jealous Casual Full Sleeve Solid Women Grey Top,32,21,26
1441,Beige cotton embroidered unstitched salwar with dupatta,23,70,33
1442,HarpaWomen Olive Green Solid Crop Sweatshirt,14,10,9
1443,Kritika's World Sleeveless Self Design Men's Jacket,101,37,40
1444,"Belmarsh Solid Women Blue, Black, Black, White Cycling Shorts",30,19,13
1445,Campus Sutra Solid Men's Blue Track Pants,72,25,23
1446,U.S. Polo Assn Slim Fit Men Beige Trousers,101,101,101
1447,Newport Full Sleeve Solid Men's Sweatshirt,101,101,101
1448,Metronaut Full Sleeve Solid Men's Jacket,1,21,3
1449,"Vero Moda Solid Women's Grey, Black Basic Shorts",1,1,2
1450,HUSTLE Solid Men's Blue Basic Shorts,101,101,101
1451,5th Anfold Men Solid Formal Dark Blue Shirt,1,1,1
1452,Green semi indo western with hand work on collar butti and embroidered buttons,1,1,1
1453,OxembergMen White Slim Fit Solid Formal Linen Shirt,1,2,1
1454,Ruse Full Sleeve Solid Men's Sweatshirt,101,101,56
1455,Fort CollinsWomen Black & Grey Printed Hooded Sweatshirt,48,2,13
1456,DressBerryWomen Grey Melange Solid Hooded Sweatshirt,7,51,19
1457, Cream And Pink Printed Chanderi Silk Saree With Blouse ,19,12,14
1458,Ansh Fashion Wear Regular Fit Men's Blue Trousers,33,33,33
1459,Secret World Solid Women Black Cycling Shorts,65,101,78
1460,Miss Chase Casual 3/4th Sleeve Solid Women's Purple Top,1,1,1
1461,Eavan Solid Women Tunic,44,53,36
1462,Peter England EliteMen Maroon Regular Fit Self Design Formal Shirt,52,8,18
1463,"Belmarsh Solid Women Blue, Blue, Blue, Blue Cycling Shorts",14,10,11
1464,"DARZI Printed Women's Grey, White Basic Shorts",11,7,9
1465, Red Embroidered Net Saree With Blouse ,1,1,1
1466,Van HeusenMen Blue Regular Fit Checked Casual Shirt,10,101,93
1467,RoadsterWomen Black Solid Sweatshirt,4,3,5
1468,"Belmarsh Solid Women Blue, Red, Blue, Black Cycling Shorts",25,1,10
1469,Indian poshakh cream semi indo jacquard kurta pajama,7,19,8
1470,Justkartit JK4739_LightViolet Lycra Solid Burqa With Hijab,79,72,67
1471,Shaftesbury LondonMen Blue Smart Regular Fit Solid Formal Shirt,101,83,101
1472,Fast n Fashion Solid Men's Light Blue Chino Shorts,5,10,7
1473,Arrow Sport Men Solid Casual Blue Shirt,5,6,3
1474,ArrowMen Purple & White Slim Fit Striped Formal Shirt,23,4,7
1475,Zink LondonWomen Pink Solid Biker Jacket,1,6,1
1476,FOREVER 21Women Brown Solid Hooded Sweatshirt,1,2,1
1477,Bonjour Solid Women's White Basic Shorts,32,101,57
1478,Van HeusenMen White & Blue Regular Fit Checked Formal Shirt,13,10,17
1479,REEBOK Printed Men's Orange Swim Shorts,2,1,1
1480,TexcoWomen Red & Black Self Design Hooded Sweatshirt,1,1,1
1481, Grey Embroidered Net Semi Stitched Salwar With Dupatta ,1,2,2
1482,Jockey Solid Women's V-neck Yellow T-Shirt,1,1,1
1483,Scallop Border Bhagalpuri Silk Long Skirt in Pink,2,2,2
1484,"Leaf Women's Solid Formal Maroon, Red Shirt",14,11,13
1485,Van HeusenMen Green Slim Fit Checked Formal Shirt,13,9,11
1486,Metronaut Full Sleeve Solid Men's Sweatshirt,1,3,1
1487,Mast & HarbourWomen Mustard Yellow Solid Bomber Jacket,2,2,2
1488,Lee Women's Printed Formal Multicolor Shirt,101,101,101
1489,Mr Button Solid Tuxedo Style Party Men's Blazer,31,101,101
1490, Blue Printed Crepe Fashion Crepe Sarees With Blouse ,18,35,19
1491,Wrangler Men's Checkered Casual Maroon Shirt,21,23,17
1492,CaymanWomen Burgundy Solid Hooded Sweatshirt,24,6,13
1493,Soundarya Solid Women's Pink Basic Shorts,20,37,23
1494,"Indian Terrain Men's Checkered Casual Red, Grey Shirt",21,1,5
1495,RaymondMen Green Slim Fit Checked Formal Shirt,30,39,27
1496,Just Khatoon ABAD1000109 Chiffon and Soft Lycra Burqa With Hijab,11,101,28
1497,Fort CollinsWomen Navy Blue & Pink Printed Sweatshirt,17,12,11
1498, Blue Printed Khadi Silk Saree With Blouse ,32,14,22
1499,Hawai WB112 Lycra Self Design Burqa With Hijab,101,39,91
1500,Lzard Regular Men's Light Blue Jeans,1,1,1
1501,Jack & Jones Men's Solid Casual Blue Shirt,101,101,101
1502,D52 Skinny Fit Men Black Trousers,34,101,48
1503,Woven Art Silk Jacquard Lehenga in Light Blue,4,23,8
1504,Plain Cotton Silk Straight Suit in Sky Blue,1,1,1
1505,Amadore Casual Short Sleeve Floral Print Women's Multicolor Top,68,101,77
1506,Maroon silk kurta set with corded collar and embroidered placket patti,18,9,12
1507,Ajile by Pantaloons Self Design Women's Round Neck Maroon T-Shirt,1,1,1
1508,Kotty Printed Men Multicolor Boxer Shorts,42,1,9
1509,DressBerryWomen Mustard Yellow Printed Ruffles Sweatshirt,1,1,1
1510,Oh Yes Solid Men's Grey Track Pants,101,101,101
1511, Women's Handloom Silk Cotton Saree Of Bengal With Blouse Dhakai Jamdani Saree(Green) ,8,20,8
1512,SoulCalWomen Charcoal Self Design Hooded Sweatshirt,5,98,16
1513,Wills LifestyleMen White & Red Regular Fit Checked Formal Shirt,35,56,33
1514, Multicolor Embroidered Satin Saree With Blouse ,101,101,101
1515, Red Dupion Dupion Semi Stitched High Slit Ethnic Suits Semi stitched ,1,2,1
1516,Pure Silk Saree in Peach,56,33,44
1517,Campus SutraWomen Olive Green Solid Biker Jacket,5,12,6
1518,Leinwand Full Sleeve Solid Men's Jacket,101,101,101
1519,ArrowMen Pink & White Slim Fit Checked Formal Shirt,1,5,2
1520,"Belmarsh Solid Women Red, Red, Blue, Black Cycling Shorts",21,16,15
1521,IVOCMen Green Smart Slim Fit Printed Formal Shirt,101,25,101
1522,AD & AV Regular Fit Men's Grey Trousers,93,3,4
1523,U.S. Polo Assn Printed Men Beige Basic Shorts,12,4,10
1524,Samriti Party Full Sleeve Color Blocked Women's Black Top,101,33,101
1525,RAREWomen Navy Blue Printed Sweatshirt,77,32,55
1526,The Dry State Solid Men & Women Round Neck Multicolor T-Shirt,15,39,19
1527,Orange and black georgette printed semi stitiched salwar with dupatta,2,1,2
1528,Bfly Printed Women's White Hotpants,101,101,101
1529, Grey And Black Printed Cotton Blend Saree With Blouse ,33,27,28
1530,Embroidered Georgette Straight Suit in Dark Teal Blue,6,6,4
1531,Nifty Solid Women's Denim Blue High Waist Shorts,101,38,71
1532,Oshano Solid Men's Waistcoat,62,5,15
1533,IVOCMen Blue Smart Slim Fit Printed Formal Shirt,101,1,101
1534,plusSWomen Pink Printed Sweatshirt,43,46,54
1535,LAWMAN PG3 Slim Men's Grey Jeans,12,45,16
1536,Goat Patti Georgette Anarkali Suit in Fuchsia,3,3,3
1537, Green And Olive Printed Soft Georgette Saree With Blouse ,5,2,3
1538,Modest Forever P313 Heather Moss Abaya,101,101,101
1539,"People Casual Sleeveless Printed Women's Red, White Top",8,2,3
1540,DFH Solid Men's Black Basic Shorts,101,101,101
1541,Miss ChaseWomen Blue Printed Denim Dungaree,3,3,3
1542,"Fashion Line Solid Women's Black, Purple, Beige Cycling Shorts",1,16,1
1543, Grey Embroidered Georgette Anarkali Lehengas Wtih Dupatta Semi stitched ,1,4,2
1544,RaymondMen Blue Regular Fit Striped Formal Shirt,1,1,1
1545,FOREVER 21Women Pink Crop Sweatshirt,2,3,2
1546,Indian poshakh gold art silk kurta pajama,53,15,36
1547, Black Printed Mysore Silk Saree With Blouse ,11,21,14
1548,Showoff Solid Men's Yellow Cargo Shorts,1,2,1
1549,Fort CollinsWomen Peach-Coloured Solid Hooded Sweatshirt,2,1,1
1550,"Belmarsh Solid Women Red, White, Red, Red Cycling Shorts",2,4,2
1551,V Dot by Van Heusen Men's Self Design Casual Grey Shirt,101,101,101
1552,English NavyMen Orange & Blue Slim Fit Checked Formal Shirt,1,2,1
1553,Maroon embroidered crepe semi stitched salwar with dupatta,1,101,19
1554,Plain Cotton Silk Churidar in Green,4,14,7
1555,PURYSWomen Off-White Floral Print Front-Open Blazer,6,2,4
1556,JG FORCEMAN Regular Fit Men Grey Trousers,101,101,101
1557,Go India Store Casual Sleeveless Printed Women's Multicolor Top,4,1,11
1558,PumaYogini Warm Black Hoodie,5,8,6
1559,"Spykar Men's Checkered Casual Black, White Shirt",19,4,5
1560,AV2 Casual Half Sleeve Printed Women Maroon Top,4,101,21
1561,U.S. Polo Assn Men's Solid Casual Blue Shirt,3,10,5
1562,Plain Rayon Patiala in Orange,1,1,1
1563,Szovet Slim Men Grey Jeans,101,4,101
1564, Green Embroidered Cotton Navratri Lehenga Chaniya Choli ,1,2,1
1565,Van HeusenMen Grey Regular Fit Checked Formal Shirt,5,1,1
1566,Momin Libas AK21017 Polyester Solid Burqa,64,101,53
1567,Abdul Haadi 2016-1 PolyCotton Solid Abaya,101,101,101
1568,Peter EnglandMen Lavender Slim Fit Printed Formal Shirt,38,73,47
1569,Peter EnglandMen Black & Purple Slim Fit Printed Formal Shirt,2,7,2
1570,Allen Solly Solid Men's Waistcoat,52,44,33
1571,Embroidered Art Silk Straight Cut Suit in Dark Blue,96,47,67
1572,"United Colors of Benetton Men's Checkered Casual Red, Dark Blue Shirt",57,37,56
1573,Black coffeeMen Black Slim Fit Solid Formal Shirt,63,22,48
1574,Van Heusen Solid Men's Dark Blue Track Pants,2,3,2
1575,"Belmarsh Solid Women Red, Black, Black, Red Cycling Shorts",10,11,8
1576,Embroidered Pure Kota Silk Straight Cut Suit in Fuchsia,4,11,5
1577,PannkhWomen Grey & Black Solid Sweatshirt,66,27,39
1578,BlackberrysMen Yellow Solid Formal Shirt,37,28,30
1579, Red And Purple Printed Cotton Saree With Blouse ,55,101,67
1580,Plain Straight Cut Brocade Suit in Pink,101,101,101
1581,Printed Cotton Pakistani Suit in Off White,45,15,25
1582,WROGN Slim Fit Men's Blue Trousers,27,15,22
1583,ArrowMen Blue & White Regular Fit Solid Formal Shirt,22,5,7
1584,TexcoWomen Red Solid Hooded Sweatshirt,13,13,12
1585,Arrow Regular Fit Men Dark Blue Trousers,101,101,101
1586,Plain Art Bhagalpuri Silk Pant in Blue,3,5,4
1587, Mimosa Beige Art Silk Kanjivaram Style Saree With Blouse ,1,9,1
1588,MeeMeeGirls Purple Dungarees with T-shirt,1,1,1
1589,Abaya AL1026 Nida & Georgette Self Design Burqa With Hijab,19,101,101
1590,ChemistryWomen Black Embroidered Hooded Sweatshirt,16,2,4
1591, Pink Resham Embroidered Silk Saree With Blouse ,1,1,1
1592,Scorpius Printed Women's Multicolor Denim Shorts,101,101,101
1593,Embroidered Art Silk Asymmetric Pakistani Suit in Red,1,1,1
1594,"Clo Clu Solid Women Round Neck White, Black T-Shirt",3,2,3
1595,Blackberrys Solid Double Breasted Party Men's Blazer,1,3,1
1596,Urbano Fashion Slim Fit Men's Brown Trousers,101,101,101
1597,Embroidered Net Layered Gown In Blue,1,1,1
1598,Lee CooperGirls Blue Washed Denim Dungarees,2,1,2
1599,"Belmarsh Solid Women Black, Red, Blue, White Cycling Shorts",40,18,20
1600, Blue And Beige Printed Mysore Silk Saree With Blouse ,6,10,7
1601,"Hypernation Striped Women's Round Neck Black, White T-Shirt",3,10,3
1602,"HUSTLE Printed Men's Blue, White, Red Track Pants",1,1,1
1603,MANGOWomen White & Blue Striped Dungarees,6,7,4
1604,FINIVO FASHION Men's Solid Casual Black Shirt,101,101,101
1605,ArrowMen Beige Slim Fit Self Design Formal Shirt,82,47,58
1606,Louis PhilippeMen Khaki Slim Fit Self Design Formal Shirt,43,69,47
1607,Momin Libas AK20217 Polyester Solid Burqa,82,101,101
1608, Green Printed Art Silk Saree With Blouse ,42,15,30
1609,Van Heusen Sport Men's Checkered Casual Multicolor Shirt,101,101,101
1610,Modest Forever P317 V. Ggt Abaya,101,101,101
1611,Jealous Club 21 Casual Half Sleeve Self Design Women Black Top,101,80,98
1612,Spykar Men's Self Design Casual Dark Blue Shirt,24,18,19
1613, Green Zari Pure Cotton Saree With Blouse ,13,25,13
1614,Black Bee Men's Solid Casual White Shirt,101,101,101
1615,agarwal enterprices Men Solid Formal Blue Shirt,56,30,51
1616,"Fashion Line Solid Women's Grey, Beige Cycling Shorts",10,4,6
1617,Van Heusen Sport Men's Self Design Casual Grey Shirt,45,24,35
1618,bhaneWomen Black Solid Tailored Jacket,19,48,27
1619,RABIYA COLLECTION FRFO85 FIRDOSE Solid Burqa With Hijab,101,101,101
1620,Kotty Animal Print Men's Maroon Regular Shorts,2,20,3
1621,Van HeusenMen Orange Custom Regular Fit Solid Formal Shirt,19,45,29
1622,Kotty Solid Women's Pink Basic Shorts,16,1,4
1623,United Colors of Benetton Men's Solid Casual Black Shirt,13,12,9
1624,TexcoWomen Mustard Solid Insulator Parka,10,9,10
1625, Maroon Printed Cotton Saree With Blouse ,101,84,94
1626, Kora Silk With Gold Foil Print Blue Designer Sarees ,101,39,101
1627,Lafantar Slim Men Blue Jeans,101,101,101
1628,John Miller Men's Checkered Casual White Shirt,29,22,14
1629,"Fashion Line Solid Women's Purple, Grey Cycling Shorts",1,6,1
1630,Van HeusenMen White Slim Fit Striped Formal Shirt,8,34,12
1631,SHADE-45 Men Solid Casual White Shirt,101,101,101
1632,plusSWomen Grey & White Printed Hooded Sweatshirt,10,2,5
1633,Platinum Studio Tuxedo Style Self Design Men Suit,101,1,87
